{
  "eventType": "InsuranceOfferAccepted", "eventVersion": 1,
  "eventId": "a848a6be-9765-4549-9326-aaf4750f8d88", "rentalId": "RENT-42",
  "sourceAuctionEventId": "b820a46d-1e3f-48a0-9459-f723c80e1260", "carId": 42,
  "plateNumber": "EDU-042", "carBrand": "Tesla", "carModel": "Model 3",
  "rentalDailyPrice": 62, "originalDailyPrice": 65, "discount": 3,
  "dailyPremium": 7, "status": "ACCEPTED", "occurredAt": "2026-10-20T09:20:00Z"
}
